path,labels,phonemes
train\Voice1015.wav,राधा कत्रो भरोसा लिएर आइरहेकी थिई त्यस साँझमा ।,ɾ aː d̪ʱ aː   k t̪  ɾ oː   bʱ ɾ oː s aː   l i eː ɾ   aː i ɾ ɦ eː k iː   t̪ʰ i iː   t̪  j s   s aː ̃ d͡ʒʱ m aː  
train\Voice822.wav,त्यसैले देश विकासका लागि शिक्षित नारीको खाँचो छ ।,t̪  j s ai l eː   d̪ eː ʃ   ʋ i k aː s k aː   l aː g i   ʃ i k  ʂ i t̪   n aː ɾ iː k oː   kʰ aː ̃ t͡ʃ oː   t͡ʃʰ  
train\Voice555.wav,“असम्भव भन्ने कुरो मूर्खहरूका शब्दकोशमा मात्र हुन्छ” भन्ने नेपोलियनको भनाइ पृथ्वीनारायणको जीवनमा पनि चरितार्थ भयो।,ə s m  bʱ ʋ   bʱ n  n eː   k u ɾ oː   m uː ɾ  kʰ ɦ ɾ uː k aː   ʃ b  d̪ k oː ʃ m aː   m aː t̪  ɾ   ɦ u n  t͡ʃʰ   bʱ n  n eː   n eː p oː l i j n k oː   bʱ n aː i   p t̪ʰ  ʋ iː n aː ɾ aː j ɳ k oː   d͡ʒ iː ʋ n m aː   p n i   t͡ʃ ɾ i t̪ aː ɾ  t̪ʰ   bʱ j oː
train\Voice673.wav,आमा हाँस्थिन्‌ छोरीले कनी-कथी गरेर पढेको देख्दा र कहिले-कहिले त्यहीँनिर बसेर उसले पढेको कथा सुन्थिन्‌ ।,aː m aː   ɦ aː ̃ s  t̪ʰ i n    t͡ʃʰ oː ɾ iː l eː   k n iː k t̪ʰ iː   g ɾ eː ɾ   p ɖʱ eː k oː   d̪ eː kʰ  d̪ aː   ɾ   k ɦ i l eː k ɦ i l eː   t̪  j ɦ iː ̃ n i ɾ   b s eː ɾ   u s l eː   p ɖʱ eː k oː   k t̪ʰ aː   s u n  t̪ʰ i n   
train\Voice120.wav,दाँती लागिसकेको थियो ।,d̪ aː ̃ t̪ iː   l aː g i s k eː k oː   t̪ʰ i j oː  
train\Voice706.wav,यो भावना पारस्परिक ‘जिउँदको जन्ती र मार्दाको मलामी’ उखान सार्थक भएको छ।,j oː   bʱ aː ʋ n aː   p aː ɾ s  p ɾ i k   d͡ʒ i u ̃ d̪ k oː   d͡ʒ n  t̪ iː   ɾ   m aː ɾ  d̪ aː k oː   m l aː m iː   u kʰ aː n   s aː ɾ  t̪ʰ k   bʱ eː k oː   t͡ʃʰ
train\Voice565.wav,उसले विदेशमा पनि कलेजमा पढ्ने विद्यार्थीहरूको एउटा संघ बनाएको थियो जहाँ नाना बिषयमा छलफल हुन्थे- प्रजातन्त्र; मार्क्सवाद; स्वतन्त्रता; समाज र व्यक्ति आदि विषयहरूमा ।,u s l eː   ʋ i d̪ eː ʃ m aː   p n i   k l eː d͡ʒ m aː   p ɖʱ  n eː   ʋ i d̪  j aː ɾ  t̪ʰ iː ɦ ɾ uː k oː   eː u ʈ aː   s ̃ gʱ   b n aː eː k oː   t̪ʰ i j oː   d͡ʒ ɦ aː ̃   n aː n aː   b i ʂ j m aː   t͡ʃʰ l pʰ l   ɦ u n  t̪ʰ eː   p  ɾ d͡ʒ aː t̪ n  t̪  ɾ   m aː ɾ  k  s ʋ aː d̪   s  ʋ t̪ n  t̪  ɾ t̪ aː   s m aː d͡ʒ   ɾ   ʋ  j k  t̪ i   aː d̪ i   ʋ i ʂ j ɦ ɾ uː m aː  
train\Voice73.wav,यसको स्वाद लीन सक्नु पनि जीवनको रमाइलो नै हो।,j s k oː   s  ʋ aː d̪   l iː n   s k  n u   p n i   d͡ʒ iː ʋ n k oː   ɾ m aː i l oː   n ai   ɦ oː
train\Voice1009.wav,"अर्को दिन जाउँला त्यता..."" चिलौनी धारबाट घर फर्किंदा मडरको पोखरी हेर्न गयौं ।",ə ɾ  k oː   d̪ i n   d͡ʒ aː u ̃ l aː   t̪  j t̪ aː   t͡ʃ i l au n iː   d̪ʱ aː ɾ b aː ʈ   gʱ ɾ   pʰ ɾ  k i ̃ d̪ aː   m ɖ ɾ k oː   p oː kʰ ɾ iː   ɦ eː ɾ  n   g j au ̃  
train\Voice730.wav,"यो हाम्रो राष्ट्रको बिकासको अनुपम धरोहर हो, यसले देशको विकास गर्न सकिन्छ।",j oː   ɦ aː m  ɾ oː   ɾ aː ʂ  ʈ  ɾ k oː   b i k aː s k oː   ə n u p m   d̪ʱ ɾ oː ɦ ɾ   ɦ oː   j s l eː   d̪ eː ʃ k oː   ʋ i k aː s   g ɾ  n   s k i n  t͡ʃʰ
train\Voice818.wav,मेरो घरमा त् झन् कसैलाई निन्द्रा पर्ने कुरै थिएन।,m eː ɾ oː   gʱ ɾ m aː   t̪    d͡ʒʱ n    k s ai l aː iː   n i n  d̪  ɾ aː   p ɾ  n eː   k u ɾ ai   t̪ʰ i eː n
train\Voice525.wav,हामी नेपालीले आफ्नो ज्ञानले सबैलाई पवित्र बनाउनुपर्छ।,ɦ aː m iː   n eː p aː l iː l eː   aː pʰ  n oː   d͡ʒ  ɲ aː n l eː   s b ai l aː iː   p ʋ i t̪  ɾ   b n aː u n u p ɾ  t͡ʃʰ
train\Voice547.wav,एक दिन उसले दुलहीलाई भन्यो साँझतिर- राधा !,eː k   d̪ i n   u s l eː   d̪ u l ɦ iː l aː iː   bʱ n  j oː   s aː ̃ d͡ʒʱ t̪ i ɾ   ɾ aː d̪ʱ aː  
train\Voice104.wav,तिब्र गतिमा बढिरहेको नसालु पदार्थलाई लागु पदार्थ भनिन्छ ।,t̪ i b  ɾ   g t̪ i m aː   b ɖʱ i ɾ ɦ eː k oː   n s aː l u   p d̪ aː ɾ  t̪ʰ l aː iː   l aː g u   p d̪ aː ɾ  t̪ʰ   bʱ n i n  t͡ʃʰ  
train\Voice652.wav,"हेर हेर, कति दुब्लो भएको छ अङ्ग्रेजी पढ्दा ।",ɦ eː ɾ   ɦ eː ɾ   k t̪ i   d̪ u b  l oː   bʱ eː k oː   t͡ʃʰ   ə ŋ  g  ɾ eː d͡ʒ iː   p ɖʱ  d̪ aː  
train\Voice127.wav,भर विभिन्न कार्यक्रमहरूको आयोजन गरी देवकोटाको जन्म जयन्ती मनाउने गरिन्छ।,bʱ ɾ   ʋ i bʱ i n  n   k aː ɾ  j k  ɾ m ɦ ɾ uː k oː   aː j oː d͡ʒ n   g ɾ iː   d̪ eː ʋ k oː ʈ aː k oː   d͡ʒ n  m   d͡ʒ j n  t̪ iː   m n aː u n eː   g ɾ i n  t͡ʃʰ
train\Voice553.wav,यस देशलाई सबैले आफ्नो साझा फूलबारी भनेका छन् र सबैले यसको हेरचाह पनि गरेकै छन्।,j s   d̪ eː ʃ l aː iː   s b ai l eː   aː pʰ  n oː   s aː d͡ʒʱ aː   pʰ uː l b aː ɾ iː   bʱ n eː k aː   t͡ʃʰ n    ɾ   s b ai l eː   j s k oː   ɦ eː ɾ t͡ʃ aː ɦ   p n i   g ɾ eː k ai   t͡ʃʰ n 
train\Voice599.wav,उहाँ बाल्यकालमा पढाईमा कमजोर थिए तर उहाँलाई गणित र विज्ञानमा रुची थियो।,u ɦ aː ̃   b aː l  j k aː l m aː   p ɖʱ aː iː m aː   k m d͡ʒ oː ɾ   t̪ʰ i eː   t̪ ɾ   u ɦ aː ̃ l aː iː   g ɳ i t̪   ɾ   ʋ i d͡ʒ  ɲ aː n m aː   ɾ u t͡ʃ iː   t̪ʰ i j oː
train\Voice567.wav,जल-सम्पदाका हिसाबले मेरो देश विश्वकै ब्राजिलपछि दोस्रो जलधानी देश र एसिया महादेशमा पहिलो जलधनी देशका रुपमा चिनिन्छ।,d͡ʒ l s m  p d̪ aː k aː   ɦ i s aː b l eː   m eː ɾ oː   d̪ eː ʃ   ʋ i ʃ  ʋ k ai   b  ɾ aː d͡ʒ i l p t͡ʃʰ i   d̪ oː s  ɾ oː   d͡ʒ l d̪ʱ aː n iː   d̪ eː ʃ   ɾ   eː s i j aː   m ɦ aː d̪ eː ʃ m aː   p ɦ i l oː   d͡ʒ l d̪ʱ n iː   d̪ eː ʃ k aː   ɾ u p m aː   t͡ʃ i n i n  t͡ʃʰ
train\Voice517.wav,थुनिएपछि उसले सुन्यो कि राधाले छोरो नै पाई ।,t̪ʰ u n i eː p t͡ʃʰ i   u s l eː   s u n  j oː   k i   ɾ aː d̪ʱ aː l eː   t͡ʃʰ oː ɾ oː   n ai   p aː iː  
train\Voice801.wav,रुसलाई समर्थन गर्नेले त्यसको परिणाम बेहोर्नुपर्ने चेतावनी दिएको बीबीसीले उल्लेख गरेको छ ।,ɾ u s l aː iː   s m ɾ  t̪ʰ n   g ɾ  n eː l eː   t̪  j s k oː   p ɾ i ɳ aː m   b eː ɦ oː ɾ  n u p ɾ  n eː   t͡ʃ eː t̪ aː ʋ n iː   d̪ i eː k oː   b iː b iː s iː l eː   u l  l eː kʰ   g ɾ eː k oː   t͡ʃʰ  
train\Voice169.wav,"सुरका पुकारहरूको सम्मिलित ध्वनि, त्यसैले हृदयको कानमा एउटा मीठो बर्षा गराइरहेको छ ।",s u ɾ k aː   p u k aː ɾ ɦ ɾ uː k oː   s m  m i l i t̪   d̪ʱ  ʋ n i   t̪  j s ai l eː   ɦ d̪ j k oː   k aː n m aː   eː u ʈ aː   m iː ʈʰ oː   b ɾ  ʂ aː   g ɾ aː i ɾ ɦ eː k oː   t͡ʃʰ  
train\Voice964.wav,येनकेन प्रकारले चारैतिर उम्रेका छन्‌ अव्यवस्थित किसिमबाट; भूप्रान्त कुनै छैन जसमा यो हरियो जाला नफैलिएको होस्‌ ।,j eː n k eː n   p  ɾ k aː ɾ l eː   t͡ʃ aː ɾ ai t̪ i ɾ   u m  ɾ eː k aː   t͡ʃʰ n    ə ʋ  j ʋ s  t̪ʰ i t̪   k i s i m b aː ʈ   bʱ uː p  ɾ aː n  t̪   k u n ai   t͡ʃʰ ai n   d͡ʒ s m aː   j oː   ɦ ɾ i j oː   d͡ʒ aː l aː   n pʰ ai l i eː k oː   ɦ oː s   
train\Voice546.wav,नेपाल गरिब मुलुक हो तर वनमा धनी छ।,n eː p aː l   g ɾ i b   m u l u k   ɦ oː   t̪ ɾ   ʋ n m aː   d̪ʱ n iː   t͡ʃʰ
train\Voice752.wav,संसारका धेरै मानिसहरू निरन्तर पर्वतारोहण गरीरहन्छन।,s ̃ s aː ɾ k aː   d̪ʱ eː ɾ ai   m aː n i s ɦ ɾ uː   n i ɾ n  t̪ ɾ   p ɾ  ʋ t̪ aː ɾ oː ɦ ɳ   g ɾ iː ɾ ɦ n  t͡ʃʰ n
train\Voice766.wav,त्यसैले म मेरो देश नेपाललाई ज्यादै माया गर्दछु र आफू नेपाली भई जन्मेकामा गौरव गर्दछु।,t̪  j s ai l eː   m   m eː ɾ oː   d̪ eː ʃ   n eː p aː l l aː iː   d͡ʒ  j aː d̪ ai   m aː j aː   g ɾ  d̪ t͡ʃʰ u   ɾ   aː pʰ uː   n eː p aː l iː   bʱ iː   d͡ʒ n  m eː k aː m aː   g au ɾ ʋ   g ɾ  d̪ t͡ʃʰ u
train\Voice534.wav,अनि अङ्ग्रेजी पनि पढ्न थाली- ए. बी. सी. डी.!,ə n i   ə ŋ  g  ɾ eː d͡ʒ iː   p n i   p ɖʱ  n   t̪ʰ aː l iː   eː   b iː   s iː   ɖ iː
train\Voice109.wav,"हाम्रो देशमा बिर गोर्खालीहरु जन्मेका हुन्, उनिहरुले शत्रुहरुलाई पराजित गरेर हाम्रो देशलाई जोगाएका हुन्।",ɦ aː m  ɾ oː   d̪ eː ʃ m aː   b i ɾ   g oː ɾ  kʰ aː l iː ɦ ɾ u   d͡ʒ n  m eː k aː   ɦ u n    u n i ɦ ɾ u l eː   ʃ t̪  ɾ u ɦ ɾ u l aː iː   p ɾ aː d͡ʒ i t̪   g ɾ eː ɾ   ɦ aː m  ɾ oː   d̪ eː ʃ l aː iː   d͡ʒ oː g aː eː k aː   ɦ u n 
train\Voice76.wav,"नेपालका पहाड, भित्रि मधेस् तथा तराई क्षेत्र गरी सबै क्षेत्रतिर नेपाली भाषा बोलिन्छ।",n eː p aː l k aː   p ɦ aː ɖ   bʱ i t̪  ɾ i   m d̪ʱ eː s    t̪ t̪ʰ aː   t̪ ɾ aː iː   k  ʂ eː t̪  ɾ   g ɾ iː   s b ai   k  ʂ eː t̪  ɾ t̪ i ɾ   n eː p aː l iː   bʱ aː ʂ aː   b oː l i n  t͡ʃʰ
train\Voice557.wav,"सोह्र मध्ये पाँच वटा ल्वाइड कम्पनिको, एउटा एलजी तथा दश वटा पानासोनिक कम्पनिको छ ।",s oː ɦ  ɾ   m d̪ʱ  j eː   p aː ̃ t͡ʃ   ʋ ʈ aː   l  ʋ aː i ɖ   k m  p n i k oː   eː u ʈ aː   eː l d͡ʒ iː   t̪ t̪ʰ aː   d̪ ʃ   ʋ ʈ aː   p aː n aː s oː n i k   k m  p n i k oː   t͡ʃʰ  
train\Voice154.wav,"त्यसैले पत्रपत्रिकाहरू पढ्नु मानिसको राम्रो बानी हो र यस्तो बानीले यसलाई सधैँ फाइदा नै हुन्छ, पत्रपत्रिकाहरू सञ्चारका भरपर्दो साधन हुन् ।",t̪  j s ai l eː   p t̪  ɾ p t̪  ɾ i k aː ɦ ɾ uː   p ɖʱ  n u   m aː n i s k oː   ɾ aː m  ɾ oː   b aː n iː   ɦ oː   ɾ   j s  t̪ oː   b aː n iː l eː   j s l aː iː   s d̪ʱ ai ̃   pʰ aː i d̪ aː   n ai   ɦ u n  t͡ʃʰ   p t̪  ɾ p t̪  ɾ i k aː ɦ ɾ uː   s ɲ  t͡ʃ aː ɾ k aː   bʱ ɾ p ɾ  d̪ oː   s aː d̪ʱ n   ɦ u n   
train\Voice147.wav,यहाँ रङ्गीबिरङ्गी चरा चुरुङ्गीहरूका मीठा गीत जस्तै धेरै किसिमका भाषा छन्।,j ɦ aː ̃   ɾ ŋ  g iː b i ɾ ŋ  g iː   t͡ʃ ɾ aː   t͡ʃ u ɾ u ŋ  g iː ɦ ɾ uː k aː   m iː ʈʰ aː   g iː t̪   d͡ʒ s  t̪ ai   d̪ʱ eː ɾ ai   k i s i m k aː   bʱ aː ʂ aː   t͡ʃʰ n 
train\Voice753.wav,त्यसै गरी विश्वका कुनाकुनामा शान्तिको संदेश छरी अमर बन्न पुगेका शान्तिका अग्रदुत गौतम बुद्ध पनि मेरै देशका बासिन्दा हुन्।,t̪  j s ai   g ɾ iː   ʋ i ʃ  ʋ k aː   k u n aː k u n aː m aː   ʃ aː n  t̪ i k oː   s ̃ d̪ eː ʃ   t͡ʃʰ ɾ iː   ə m ɾ   b n  n   p u g eː k aː   ʃ aː n  t̪ i k aː   ə g  ɾ d̪ u t̪   g au t̪ m   b u d̪  d̪ʱ   p n i   m eː ɾ ai   d̪ eː ʃ k aː   b aː s i n  d̪ aː   ɦ u n 
train\Voice829.wav,यसको महत्व बुझने मानिस नै अहिले अगाडि बढेका उदहारण सहित पाइन्छ।,j s k oː   m ɦ t̪  ʋ   b u d͡ʒʱ n eː   m aː n i s   n ai   ə ɦ i l eː   ə g aː ɖ i   b ɖʱ eː k aː   u d̪ ɦ aː ɾ ɳ   s ɦ i t̪   p aː i n  t͡ʃʰ
train\Voice934.wav,अझै गाउहरुमा पुस्तकालयको धेरै नै कमी छ र अविकसित ठाउँ भनेको गाउँ नै हो।,ə d͡ʒʱ ai   g aː u ɦ ɾ u m aː   p u s  t̪ k aː l j k oː   d̪ʱ eː ɾ ai   n ai   k m iː   t͡ʃʰ   ɾ   ə ʋ i k s i t̪   ʈʰ aː u ̃   bʱ n eː k oː   g aː u ̃   n ai   ɦ oː
train\Voice792.wav,नेपाल आमालाई पिर परेको बेला हामी अगाडि बढ्छौ र देशलाई संकटबाट मुक्त गर्छौ।,n eː p aː l   aː m aː l aː iː   p i ɾ   p ɾ eː k oː   b eː l aː   ɦ aː m iː   ə g aː ɖ i   b ɖʱ  t͡ʃʰ au   ɾ   d̪ eː ʃ l aː iː   s ̃ k ʈ b aː ʈ   m u k  t̪   g ɾ  t͡ʃʰ au
train\Voice116.wav,त्यसै गरी यस चाडमा खेलिने भैलो र देउसीलाई पैसा कमाउन मध्यम बनाउने दुष्प्रवृत्ति पनि बढ्दो छ।,t̪  j s ai   g ɾ iː   j s   t͡ʃ aː ɖ m aː   kʰ eː l i n eː   bʱ ai l oː   ɾ   d̪ eː u s iː l aː iː   p ai s aː   k m aː u n   m d̪ʱ  j m   b n aː u n eː   d̪ u ʂ  p  ɾ ʋ t̪  t̪ i   p n i   b ɖʱ  d̪ oː   t͡ʃʰ
train\Voice765.wav,पर्वतारोहणले कुनै पनि चुचुरोमा पुग्ने व्यक्तिले जीवनमा आइपर्ने जस्तोसुकै समस्यासँग लड्न।,p ɾ  ʋ t̪ aː ɾ oː ɦ ɳ l eː   k u n ai   p n i   t͡ʃ u t͡ʃ u ɾ oː m aː   p u g  n eː   ʋ  j k  t̪ i l eː   d͡ʒ iː ʋ n m aː   aː i p ɾ  n eː   d͡ʒ s  t̪ oː s u k ai   s m s  j aː s ̃ g   l ɖ  n
train\Voice895.wav,हाम्रा पुर्खाहरू आफ्नो स्वाभिमानमा अडेका थिए।,ɦ aː m  ɾ aː   p u ɾ  kʰ aː ɦ ɾ uː   aː pʰ  n oː   s  ʋ aː bʱ i m aː n m aː   ə ɖ eː k aː   t̪ʰ i eː
train\Voice529.wav,हाम्रो देश नेपालमा दश प्रतिशत व्यापारीले पनि राम्ररी कर तिर्दैनन् र यसको परिणाम पनि हामीले नै भोग्ने गर्छौ।,ɦ aː m  ɾ oː   d̪ eː ʃ   n eː p aː l m aː   d̪ ʃ   p  ɾ t̪ i ʃ t̪   ʋ  j aː p aː ɾ iː l eː   p n i   ɾ aː m  ɾ ɾ iː   k ɾ   t̪ i ɾ  d̪ ai n n    ɾ   j s k oː   p ɾ i ɳ aː m   p n i   ɦ aː m iː l eː   n ai   bʱ oː g  n eː   g ɾ  t͡ʃʰ au
train\Voice850.wav,"म जन्मदा घरका सबै जना खुसीले ढङ्ग हुनुहुन्थ्यो रे! उहाँहरुका लागि म  घरको जगमगाउँदा बत्ती थिए, कुलको धरोहर थिए।",m   d͡ʒ n  m d̪ aː   gʱ ɾ k aː   s b ai   d͡ʒ n aː   kʰ u s iː l eː   ɖʱ ŋ  g   ɦ u n u ɦ u n  t̪ʰ  j oː   ɾ eː   u ɦ aː ̃ ɦ ɾ u k aː   l aː g i   m     gʱ ɾ k oː   d͡ʒ g m g aː u ̃ d̪ aː   b t̪  t̪ iː   t̪ʰ i eː   k u l k oː   d̪ʱ ɾ oː ɦ ɾ   t̪ʰ i eː
train\Voice532.wav,कति विश्वास र भरको ढुकुटी लिएर मेरा लागि बसिरहेका थिए ती उड्न लागेका राता-काला बुट्टाहरू ।,k t̪ i   ʋ i ʃ  ʋ aː s   ɾ   bʱ ɾ k oː   ɖʱ u k u ʈ iː   l i eː ɾ   m eː ɾ aː   l aː g i   b s i ɾ ɦ eː k aː   t̪ʰ i eː   t̪ iː   u ɖ  n   l aː g eː k aː   ɾ aː t̪ aː k aː l aː   b u ʈ  ʈ aː ɦ ɾ uː  
train\Voice56.wav,"भैंसवार ठिटो पछर्वारेया धारमा भैंसीलाई नुहाउन गएको थियो, हामी दुबैले दुईचोटि कोशीको धारलाई पार गर्यौं ।",bʱ ai ̃ s ʋ aː ɾ   ʈʰ i ʈ oː   p t͡ʃʰ ɾ  ʋ aː ɾ eː j aː   d̪ʱ aː ɾ m aː   bʱ ai ̃ s iː l aː iː   n u ɦ aː u n   g eː k oː   t̪ʰ i j oː   ɦ aː m iː   d̪ u b ai l eː   d̪ u iː t͡ʃ oː ʈ i   k oː ʃ iː k oː   d̪ʱ aː ɾ l aː iː   p aː ɾ   g ɾ  j au ̃  
train\Voice85.wav,उहाँले यो आविष्कार गरेर आफ्नो नाम अहिले कमाइरहेका छन्।,u ɦ aː ̃ l eː   j oː   aː ʋ i ʂ  k aː ɾ   g ɾ eː ɾ   aː pʰ  n oː   n aː m   ə ɦ i l eː   k m aː i ɾ ɦ eː k aː   t͡ʃʰ n 
train\Voice1002.wav,त्यसैले आज भोलि म घरीघरी आफ्नो बाल्यकालको मीठो सम्झना गरेर मन बहलाउने गर्दछु।,t̪  j s ai l eː   aː d͡ʒ   bʱ oː l i   m   gʱ ɾ iː gʱ ɾ iː   aː pʰ  n oː   b aː l  j k aː l k oː   m iː ʈʰ oː   s m  d͡ʒʱ n aː   g ɾ eː ɾ   m n   b ɦ l aː u n eː   g ɾ  d̪ t͡ʃʰ u
train\Voice793.wav,म आफूभन्दा ठूलालाई आदर गर्थे र उहाहरुलाई अह्राएको कम नअनकनाएका खुरुखुरु गरि दिन्थे ।,m   aː pʰ uː bʱ n  d̪ aː   ʈʰ uː l aː l aː iː   aː d̪ ɾ   g ɾ  t̪ʰ eː   ɾ   u ɦ aː ɦ ɾ u l aː iː   ə ɦ  ɾ aː eː k oː   k m   n ə n k n aː eː k aː   kʰ u ɾ u kʰ u ɾ u   g ɾ i   d̪ i n  t̪ʰ eː  
train\Voice139.wav,कलाकृतिहरुले पनि भरिएको मेरो देश विश्वमै एक अनौठो र आफ्नै प्रकारका विशेषता भएको रमाइलो देश बन्न पुगेको छ।,k l aː k t̪ i ɦ ɾ u l eː   p n i   bʱ ɾ i eː k oː   m eː ɾ oː   d̪ eː ʃ   ʋ i ʃ  ʋ m ai   eː k   ə n au ʈʰ oː   ɾ   aː pʰ  n ai   p  ɾ k aː ɾ k aː   ʋ i ʃ eː ʂ t̪ aː   bʱ eː k oː   ɾ m aː i l oː   d̪ eː ʃ   b n  n   p u g eː k oː   t͡ʃʰ
train\Voice983.wav,हामीहरू उभिया ठाउँनिर नदी यसो बाङ्गिएर पूर्वतिर लागेको छ्‌ ।,ɦ aː m iː ɦ ɾ uː   u bʱ i j aː   ʈʰ aː u ̃ n i ɾ   n d̪ iː   j s oː   b aː ŋ  g i eː ɾ   p uː ɾ  ʋ t̪ i ɾ   l aː g eː k oː   t͡ʃʰ   
train\Voice82.wav,जेठो छोरोले त्यति अङ्ग्रेजी पढिहाल्यो; अब घर बसोस्‌ र खेती हेरोस्‌ ।,d͡ʒ eː ʈʰ oː   t͡ʃʰ oː ɾ oː l eː   t̪  j t̪ i   ə ŋ  g  ɾ eː d͡ʒ iː   p ɖʱ i ɦ aː l  j oː   ə b   gʱ ɾ   b s oː s    ɾ   kʰ eː t̪ iː   ɦ eː ɾ oː s   
train\Voice140.wav,त्यहाँ आरामपूर्वक जीवन बिताउने र एक भव्य जीवनशैली बीच एक फरक छ।,t̪  j ɦ aː ̃   aː ɾ aː m p uː ɾ  ʋ k   d͡ʒ iː ʋ n   b i t̪ aː u n eː   ɾ   eː k   bʱ ʋ  j   d͡ʒ iː ʋ n ʃ ai l iː   b iː t͡ʃ   eː k   pʰ ɾ k   t͡ʃʰ
train\Voice764.wav,"अनुशासनमा नरहने मानिस लगामविनाको घोडाजस्तै हुन्छ, उसले जीवनमा केही गर्न सक्तैन।",ə n u ʃ aː s n m aː   n ɾ ɦ n eː   m aː n i s   l g aː m ʋ i n aː k oː   gʱ oː ɖ aː d͡ʒ s  t̪ ai   ɦ u n  t͡ʃʰ   u s l eː   d͡ʒ iː ʋ n m aː   k eː ɦ iː   g ɾ  n   s k  t̪ ai n
train\Voice942.wav,बाल्यकालमा बिहे गराउने चलनलाई वाल विवाह भनिन्छ।,b aː l  j k aː l m aː   b i ɦ eː   g ɾ aː u n eː   t͡ʃ l n l aː iː   ʋ aː l   ʋ i ʋ aː ɦ   bʱ n i n  t͡ʃʰ
train\Voice656.wav,"नाककोरेको साग, कोशीले छाडेर गएको ठाउँमा जमेको पाँक र त्यहाँको दलदल जसमा फुलकाहीका बाब्‌साहेबहरूको हात्ती भास्सिएर मरेको।",n aː k k oː ɾ eː k oː   s aː g   k oː ʃ iː l eː   t͡ʃʰ aː ɖ eː ɾ   g eː k oː   ʈʰ aː u ̃ m aː   d͡ʒ m eː k oː   p aː ̃ k   ɾ   t̪  j ɦ aː ̃ k oː   d̪ l d̪ l   d͡ʒ s m aː   pʰ u l k aː ɦ iː k aː   b aː b  s aː ɦ eː b ɦ ɾ uː k oː   ɦ aː t̪  t̪ iː   bʱ aː s  s i eː ɾ   m ɾ eː k oː
train\Voice564.wav,"यहाँको वायु पनि त्यस्तै निर्गन्ध, काशीको हावामा नाना किसिमका गन्ध लादिया हुन्थे, नाला-पनालाको गन्ध,",j ɦ aː ̃ k oː   ʋ aː j u   p n i   t̪  j s  t̪ ai   n i ɾ  g n  d̪ʱ   k aː ʃ iː k oː   ɦ aː ʋ aː m aː   n aː n aː   k i s i m k aː   g n  d̪ʱ   l aː d̪ i j aː   ɦ u n  t̪ʰ eː   n aː l aː p n aː l aː k oː   g n  d̪ʱ
train\Voice763.wav,यही बमकाण्डभन्दा केही दिन पहिलेको कुरा ।,j ɦ iː   b m k aː ɳ  ɖ bʱ n  d̪ aː   k eː ɦ iː   d̪ i n   p ɦ i l eː k oː   k u ɾ aː  
train\Voice146.wav,अन्तर्कलहले गर्दा चर्किदैं र ढल्दै गरेको देखे; त्यसबाट संसारमा सूर्य नअस्ताउने देशका रूपमा उपनिवेश फैलाउँदै गरेको ।,ə n  t̪ ɾ  k l ɦ l eː   g ɾ  d̪ aː   t͡ʃ ɾ  k i d̪ ai ̃   ɾ   ɖʱ l  d̪ ai   g ɾ eː k oː   d̪ eː kʰ eː   t̪  j s b aː ʈ   s ̃ s aː ɾ m aː   s uː ɾ  j   n ə s  t̪ aː u n eː   d̪ eː ʃ k aː   ɾ uː p m aː   u p n i ʋ eː ʃ   pʰ ai l aː u ̃ d̪ ai   g ɾ eː k oː  
train\Voice33.wav,"दूबो पनि छ, तर खोइ, त्यो कम्पनीको बगैंचाको संयम यिनीहरूमा ? खोइ, त्यो सुसंस्कृत, सुव्यवस्थित रचना यिनीहरूको ?",d̪ uː b oː   p n i   t͡ʃʰ   t̪ ɾ   kʰ oː i   t̪  j oː   k m  p n iː k oː   b g ai ̃ t͡ʃ aː k oː   s ̃ j m   j i n iː ɦ ɾ uː m aː     kʰ oː i   t̪  j oː   s u s ̃ s  k t̪   s u ʋ  j ʋ s  t̪ʰ i t̪   ɾ t͡ʃ n aː   j i n iː ɦ ɾ uː k oː  
train\Voice130.wav,सानो भाइ आफ्नो स्कुलमा राजनीतिका कुरा गर्दो हो र भन्दो हो- नेपालमा प्रजातन्त्र ल्याउनुपर्छ ।,s aː n oː   bʱ aː i   aː pʰ  n oː   s  k u l m aː   ɾ aː d͡ʒ n iː t̪ i k aː   k u ɾ aː   g ɾ  d̪ oː   ɦ oː   ɾ   bʱ n  d̪ oː   ɦ oː   n eː p aː l m aː   p  ɾ d͡ʒ aː t̪ n  t̪  ɾ   l  j aː u n u p ɾ  t͡ʃʰ  
