path,labels,phonemes
train\Voice568.wav,धेरैजसो व्यक्तिहरूले पर्वतारोहणमा नयाँ कीर्तिमान कायम गरेर आफ्नो नाम पनि खाँसै राखेकै छन्।,d̪ʱ eː ɾ ai d͡ʒ s oː   ʋ  j k  t̪ i ɦ ɾ uː l eː   p ɾ  ʋ t̪ aː ɾ oː ɦ ɳ m aː   n j aː ̃   k iː ɾ  t̪ i m aː n   k aː j m   g ɾ eː ɾ   aː pʰ  n oː   n aː m   p n i   kʰ aː ̃ s ai   ɾ aː kʰ eː k ai   t͡ʃʰ n 
train\Voice544.wav,धनकी देवी लक्ष्मीले कृपा गरिन् भने भइन्छ भन्ने विश्वास सबै हिन्दूहरूमा रहेको छ।,d̪ʱ n k iː   d̪ eː ʋ iː   l k  ʂ  m iː l eː   k p aː   g ɾ i n    bʱ n eː   bʱ i n  t͡ʃʰ   bʱ n  n eː   ʋ i ʃ  ʋ aː s   s b ai   ɦ i n  d̪ uː ɦ ɾ uː m aː   ɾ ɦ eː k oː   t͡ʃʰ
train\Voice533.wav,यो ठूलो रूख पाकडको रूख हो ।,j oː   ʈʰ uː l oː   ɾ uː kʰ   p aː k ɖ k oː   ɾ uː kʰ   ɦ oː  
train\Voice855.wav,बर्षमा एक पटक चिच्याएर 'दिवस' मनाउदैमा के फरक पर्छ नारीहरुको अध्यावधी पिछडित दयनिय कुचक्रित यथार्थमा?? ।,b ɾ  ʂ m aː   eː k   p ʈ k   t͡ʃ i t͡ʃ  j aː eː ɾ   d̪ i ʋ s   m n aː u d̪ ai m aː   k eː   pʰ ɾ k   p ɾ  t͡ʃʰ   n aː ɾ iː ɦ ɾ u k oː   ə d̪ʱ  j aː ʋ d̪ʱ iː   p i t͡ʃʰ ɖ i t̪   d̪ j n i j   k u t͡ʃ k  ɾ i t̪   j t̪ʰ aː ɾ  t̪ʰ m aː  
train\Voice761.wav,"सलाई बनाउने काठ, चन्दन, रबडको लस्सा, लह, मसला, बास इत्यादि वनबाट प्राप्त हुने गर्छ।",s l aː iː   b n aː u n eː   k aː ʈʰ   t͡ʃ n  d̪ n   ɾ b ɖ k oː   l s  s aː   l ɦ   m s l aː   b aː s   i t̪  j aː d̪ i   ʋ n b aː ʈ   p  ɾ aː p  t̪   ɦ u n eː   g ɾ  t͡ʃʰ
train\Voice648.wav,"तथापि, यसलाई ठूलो व्यावसायिक बनाउन र अत्याधिक इच्छाहरु को लागी अधिक र अधिक कमाई को लागी मान्छेले काम मा धेरै समय खर्च गर्दछ र आफ्नो आमाबाबु, पति र बच्चाहरुलाई बेवास्ता गर्छन।",t̪ t̪ʰ aː p i   j s l aː iː   ʈʰ uː l oː   ʋ  j aː ʋ s aː j i k   b n aː u n   ɾ   ə t̪  j aː d̪ʱ i k   i t͡ʃ  t͡ʃʰ aː ɦ ɾ u   k oː   l aː g iː   ə d̪ʱ i k   ɾ   ə d̪ʱ i k   k m aː iː   k oː   l aː g iː   m aː n  t͡ʃʰ eː l eː   k aː m   m aː   d̪ʱ eː ɾ ai   s m j   kʰ ɾ  t͡ʃ   g ɾ  d̪ t͡ʃʰ   ɾ   aː pʰ  n oː   aː m aː b aː b u   p t̪ i   ɾ   b t͡ʃ  t͡ʃ aː ɦ ɾ u l aː iː   b eː ʋ aː s  t̪ aː   g ɾ  t͡ʃʰ n
train\Voice949.wav,नेपालबाहिर बस्ने हिन्दू नेपालीहरू पनि यस चाडलाई उतिकै महत्त्व दिई मनाउँछन्।,n eː p aː l b aː ɦ i ɾ   b s  n eː   ɦ i n  d̪ uː   n eː p aː l iː ɦ ɾ uː   p n i   j s   t͡ʃ aː ɖ l aː iː   u t̪ i k ai   m ɦ t̪  t̪  ʋ   d̪ i iː   m n aː u ̃ t͡ʃʰ n 
train\Voice69.wav,यस दिनलाई ‘भाइटीका’ पनि भनिन्छ।,j s   d̪ i n l aː iː   bʱ aː i ʈ iː k aː   p n i   bʱ n i n  t͡ʃʰ
train\Voice827.wav,विदेशी विद्वान्हरूको चासोको विषय बन्नु नेपाली भाषाको ठूलै उपलब्धि हो।,ʋ i d̪ eː ʃ iː   ʋ i d̪  ʋ aː n  ɦ ɾ uː k oː   t͡ʃ aː s oː k oː   ʋ i ʂ j   b n  n u   n eː p aː l iː   bʱ aː ʂ aː k oː   ʈʰ uː l ai   u p l b  d̪ʱ i   ɦ oː
train\Voice672.wav,अझै हाम्रो समाजमा चेलीबेटी बेचबेखन पनि तिब्र गतिमा बढिरहेको छ।,ə d͡ʒʱ ai   ɦ aː m  ɾ oː   s m aː d͡ʒ m aː   t͡ʃ eː l iː b eː ʈ iː   b eː t͡ʃ b eː kʰ n   p n i   t̪ i b  ɾ   g t̪ i m aː   b ɖʱ i ɾ ɦ eː k oː   t͡ʃʰ
train\Voice523.wav,"साहोडको भ्याङ जसबाट राम्रा-राम्रा दतिउन काटिन्छन्‌, बकाइनो जो नीमको रूख होइन, पटेर र झाडका जङ्गल जो कोशीका दुवै किनारामा छन्‌।",s aː ɦ oː ɖ k oː   bʱ  j aː ŋ   d͡ʒ s b aː ʈ   ɾ aː m  ɾ aː ɾ aː m  ɾ aː   d̪ t̪ i u n   k aː ʈ i n  t͡ʃʰ n    b k aː i n oː   d͡ʒ oː   n iː m k oː   ɾ uː kʰ   ɦ oː i n   p ʈ eː ɾ   ɾ   d͡ʒʱ aː ɖ k aː   d͡ʒ ŋ  g l   d͡ʒ oː   k oː ʃ iː k aː   d̪ u ʋ ai   k i n aː ɾ aː m aː   t͡ʃʰ n 
train\Voice870.wav,नेपालीहरुका अरु निकै पुराना चालचलनहरु देख्दा मख्ख पर्ने विदेशी पर्यटकहरु नेपाल भ्रमणको मीठो सम्झना आफ्नो हृदयको झोलामा भरेर लैजान्छन।,n eː p aː l iː ɦ ɾ u k aː   ə ɾ u   n i k ai   p u ɾ aː n aː   t͡ʃ aː l t͡ʃ l n ɦ ɾ u   d̪ eː kʰ  d̪ aː   m kʰ  kʰ   p ɾ  n eː   ʋ i d̪ eː ʃ iː   p ɾ  j ʈ k ɦ ɾ u   n eː p aː l   bʱ  ɾ m ɳ k oː   m iː ʈʰ oː   s m  d͡ʒʱ n aː   aː pʰ  n oː   ɦ d̪ j k oː   d͡ʒʱ oː l aː m aː   bʱ ɾ eː ɾ   l ai d͡ʒ aː n  t͡ʃʰ n
train\Voice1000.wav,चुँडाल्न सक्छ र विकासको अभियानमा देशले लामो फड्को मार्न सक्छ।,t͡ʃ u ̃ ɖ aː l  n   s k  t͡ʃʰ   ɾ   ʋ i k aː s k oː   ə bʱ i j aː n m aː   d̪ eː ʃ l eː   l aː m oː   pʰ ɖ  k oː   m aː ɾ  n   s k  t͡ʃʰ
train\Voice124.wav,"त्यसै ऊ कुनै किसिमको बाधा, बन्धन, रोकावट, दबाब आदि मा नरही फुक्का हुन् चाहन्छ, मानिस कुनै पनि किसिमको बन्धन मन पराउँदैनन्, जसरी चराहरू फुक्का भई ।",t̪  j s ai   uː   k u n ai   k i s i m k oː   b aː d̪ʱ aː   b n  d̪ʱ n   ɾ oː k aː ʋ ʈ   d̪ b aː b   aː d̪ i   m aː   n ɾ ɦ iː   pʰ u k  k aː   ɦ u n    t͡ʃ aː ɦ n  t͡ʃʰ   m aː n i s   k u n ai   p n i   k i s i m k oː   b n  d̪ʱ n   m n   p ɾ aː u ̃ d̪ ai n n    d͡ʒ s ɾ iː   t͡ʃ ɾ aː ɦ ɾ uː   pʰ u k  k aː   bʱ iː  
train\Voice87.wav,बतहिया चमाइन जो बोक्सी थी र जसको घर गाउँभन्दा छुट्टै दक्खिनपट्टि थियो ।,b t̪ ɦ i j aː   t͡ʃ m aː i n   d͡ʒ oː   b oː k  s iː   t̪ʰ iː   ɾ   d͡ʒ s k oː   gʱ ɾ   g aː u ̃ bʱ n  d̪ aː   t͡ʃʰ u ʈ  ʈ ai   d̪ k  kʰ i n p ʈ  ʈ i   t̪ʰ i j oː  
train\Voice597.wav,"जंगल जंगली जनावर, पक्षीहरूको आरक्षण पनि हो।",d͡ʒ ̃ g l   d͡ʒ ̃ g l iː   d͡ʒ n aː ʋ ɾ   p k  ʂ iː ɦ ɾ uː k oː   aː ɾ k  ʂ ɳ   p n i   ɦ oː
train\Voice862.wav,हुने बिरुवाको चिल्लो पात भने झैँ पृथ्वीनारायण शाह सानेदेखि होनहार र प्रतिभाशाली व्यक्ति थिए।,ɦ u n eː   b i ɾ u ʋ aː k oː   t͡ʃ i l  l oː   p aː t̪   bʱ n eː   d͡ʒʱ ai ̃   p t̪ʰ  ʋ iː n aː ɾ aː j ɳ   ʃ aː ɦ   s aː n eː d̪ eː kʰ i   ɦ oː n ɦ aː ɾ   ɾ   p  ɾ t̪ i bʱ aː ʃ aː l iː   ʋ  j k  t̪ i   t̪ʰ i eː
train\Voice136.wav,सत्र सय उनासी साल पौष सत्ताइस गतेका दिन गोर्खाको दरबारमा भएको हो।,s t̪  ɾ   s j   u n aː s iː   s aː l   p au ʂ   s t̪  t̪ aː i s   g t̪ eː k aː   d̪ i n   g oː ɾ  kʰ aː k oː   d̪ ɾ b aː ɾ m aː   bʱ eː k oː   ɦ oː
train\Voice657.wav,सामाजिक समस्या यसका ज्ञानले हटाउन सकिन्छ।,s aː m aː d͡ʒ i k   s m s  j aː   j s k aː   d͡ʒ  ɲ aː n l eː   ɦ ʈ aː u n   s k i n  t͡ʃʰ
train\Voice107.wav,अनन्तसम्म पर्खन पनि तयार हुनुपर्छ तर यत्रो द्रुतगतिमा बढिरहेको दुनियाँमा के हामी नेपालीले अनन्तसम्म पर्खिरहने !,ə n n  t̪ s m  m   p ɾ  kʰ n   p n i   t̪ j aː ɾ   ɦ u n u p ɾ  t͡ʃʰ   t̪ ɾ   j t̪  ɾ oː   d̪  ɾ u t̪ g t̪ i m aː   b ɖʱ i ɾ ɦ eː k oː   d̪ u n i j aː ̃ m aː   k eː   ɦ aː m iː   n eː p aː l iː l eː   ə n n  t̪ s m  m   p ɾ  kʰ i ɾ ɦ n eː  
train\Voice824.wav,तिनको सौन्दर्यले सबैको मन लोभित हुन्छ।,t̪ i n k oː   s au n  d̪ ɾ  j l eː   s b ai k oː   m n   l oː bʱ i t̪   ɦ u n  t͡ʃʰ
train\Voice772.wav,"खस सम्प्रदाय अन्तर्गतका ठकुरी शाह वंशका राजा पृथ्वीनारायण शाहले गोर्खा जस्तो पहाडी राज्यका राजा भएर उपत्यकाका नेवारहरूको हृदय बुझ्नु, किरातहरूको आँत जित्नु कम चानचुने कुरो थिएन।",kʰ s   s m  p  ɾ d̪ aː j   ə n  t̪ ɾ  g t̪ k aː   ʈʰ k u ɾ iː   ʃ aː ɦ   ʋ ̃ ʃ k aː   ɾ aː d͡ʒ aː   p t̪ʰ  ʋ iː n aː ɾ aː j ɳ   ʃ aː ɦ l eː   g oː ɾ  kʰ aː   d͡ʒ s  t̪ oː   p ɦ aː ɖ iː   ɾ aː d͡ʒ  j k aː   ɾ aː d͡ʒ aː   bʱ eː ɾ   u p t̪  j k aː k aː   n eː ʋ aː ɾ ɦ ɾ uː k oː   ɦ d̪ j   b u d͡ʒʱ  n u   k i ɾ aː t̪ ɦ ɾ uː k oː   aː ̃ t̪   d͡ʒ i t̪  n u   k m   t͡ʃ aː n t͡ʃ u n eː   k u ɾ oː   t̪ʰ i eː n
train\Voice649.wav,फेरि कमिश्नरले बडो कोमल स्वरमा अन्तिम बार सोधे- तिम्रो अन्तिम इच्छा के छ !; केही भन्नु छ?,pʰ eː ɾ i   k m i ʃ  n ɾ l eː   b ɖ oː   k oː m l   s  ʋ ɾ m aː   ə n  t̪ i m   b aː ɾ   s oː d̪ʱ eː   t̪ i m  ɾ oː   ə n  t̪ i m   i t͡ʃ  t͡ʃʰ aː   k eː   t͡ʃʰ     k eː ɦ iː   bʱ n  n u   t͡ʃʰ
train\Voice767.wav,"कहाँ बाहिर ? यहाँ बाहिर, भित्र भन्ने छुट्टिएका दुई तत्त्व छन्‌ र : यहाँ त सबै क्रा बाहिरै बाहिर छ- उदाङ्ग ।",k ɦ aː ̃   b aː ɦ i ɾ     j ɦ aː ̃   b aː ɦ i ɾ   bʱ i t̪  ɾ   bʱ n  n eː   t͡ʃʰ u ʈ  ʈ i eː k aː   d̪ u iː   t̪ t̪  t̪  ʋ   t͡ʃʰ n    ɾ     j ɦ aː ̃   t̪   s b ai   k  ɾ aː   b aː ɦ i ɾ ai   b aː ɦ i ɾ   t͡ʃʰ   u d̪ aː ŋ  g  
train\Voice12.wav,घरघरमा बत्ती निभेका छन्‌ ।,gʱ ɾ gʱ ɾ m aː   b t̪  t̪ iː   n i bʱ eː k aː   t͡ʃʰ n   
train\Voice18.wav,किशोरले कोठामा एकचोटि दृष्टिपात गर्‍यो ।,k i ʃ oː ɾ l eː   k oː ʈʰ aː m aː   eː k t͡ʃ oː ʈ i   d̪ ʂ  ʈ i p aː t̪   g ɾ  j oː  
train\Voice628.wav,"मन टुहरो हुन्छ, घबडाहटले आमाकहाँ टाँस्सन पुग्छ, त्यो भयभीत बालक ।",m n   ʈ u ɦ ɾ oː   ɦ u n  t͡ʃʰ   gʱ b ɖ aː ɦ ʈ l eː   aː m aː k ɦ aː ̃   ʈ aː ̃ s  s n   p u g  t͡ʃʰ   t̪  j oː   bʱ j bʱ iː t̪   b aː l k  
train\Voice589.wav,सो वैवाहिक सम्बन्धमा समस्या बल्झेपछि बनारसका राजपूत अभिमानसिंहकी छोरी नरेन्द्रलक्ष्मीसँग बिहे गरेका थिए।,s oː   ʋ ai ʋ aː ɦ i k   s m  b n  d̪ʱ m aː   s m s  j aː   b l  d͡ʒʱ eː p t͡ʃʰ i   b n aː ɾ s k aː   ɾ aː d͡ʒ p uː t̪   ə bʱ i m aː n s i ̃ ɦ k iː   t͡ʃʰ oː ɾ iː   n ɾ eː n  d̪  ɾ l k  ʂ  m iː s ̃ g   b i ɦ eː   g ɾ eː k aː   t̪ʰ i eː
train\Voice653.wav,न्वारनको नाउँ आमासँग सोध्न्‌ ।,n  ʋ aː ɾ n k oː   n aː u ̃   aː m aː s ̃ g   s oː d̪ʱ  n   
train\Voice998.wav,इरानले उपलब्ध गराएका ड्रोनहरूको प्रयोग गरेर रुसले युक्रेनी ऊर्जा केन्द्रमा आक्रमण गरेको छ।,i ɾ aː n l eː   u p l b  d̪ʱ   g ɾ aː eː k aː   ɖ  ɾ oː n ɦ ɾ uː k oː   p  ɾ j oː g   g ɾ eː ɾ   ɾ u s l eː   j u k  ɾ eː n iː   uː ɾ  d͡ʒ aː   k eː n  d̪  ɾ m aː   aː k  ɾ m ɳ   g ɾ eː k oː   t͡ʃʰ
train\Voice970.wav,बगैँचामा रङ्गीबिरङ्गी फूलहरू रहे झैँ यहाँ धेरै जात जाति छन्।,b g ai ̃ t͡ʃ aː m aː   ɾ ŋ  g iː b i ɾ ŋ  g iː   pʰ uː l ɦ ɾ uː   ɾ ɦ eː   d͡ʒʱ ai ̃   j ɦ aː ̃   d̪ʱ eː ɾ ai   d͡ʒ aː t̪   d͡ʒ aː t̪ i   t͡ʃʰ n 
train\Voice526.wav,आज यो आधुनिक युगमा मानिस आफ्नो स्वार्थ र कमाउनको लागि अरुलाई मार्ने काम गरछन् ।,aː d͡ʒ   j oː   aː d̪ʱ u n i k   j u g m aː   m aː n i s   aː pʰ  n oː   s  ʋ aː ɾ  t̪ʰ   ɾ   k m aː u n k oː   l aː g i   ə ɾ u l aː iː   m aː ɾ  n eː   k aː m   g ɾ t͡ʃʰ n   
train\Voice39.wav,हामी नेपाली विर गोर्खाली रगतले हार मान्दैनौ र गौतम बुद्धको शिक्षालाई चारै तर्फ बाढ्छौ।,ɦ aː m iː   n eː p aː l iː   ʋ i ɾ   g oː ɾ  kʰ aː l iː   ɾ g t̪ l eː   ɦ aː ɾ   m aː n  d̪ ai n au   ɾ   g au t̪ m   b u d̪  d̪ʱ k oː   ʃ i k  ʂ aː l aː iː   t͡ʃ aː ɾ ai   t̪ ɾ  pʰ   b aː ɖʱ  t͡ʃʰ au
train\Voice758.wav,"समाजमा बसेपछि एक-अर्काको कदर गर्ने, सामाजिक नीतिनियमको पालना गर्ने, दुख परेको बेलामा एकले अर्कालाई सक्दो सहयोग गर्ने अनि कसैप्रति भेदभाव ।",s m aː d͡ʒ m aː   b s eː p t͡ʃʰ i   eː k ə ɾ  k aː k oː   k d̪ ɾ   g ɾ  n eː   s aː m aː d͡ʒ i k   n iː t̪ i n i j m k oː   p aː l n aː   g ɾ  n eː   d̪ u kʰ   p ɾ eː k oː   b eː l aː m aː   eː k l eː   ə ɾ  k aː l aː iː   s k  d̪ oː   s ɦ j oː g   g ɾ  n eː   ə n i   k s ai p  ɾ t̪ i   bʱ eː d̪ bʱ aː ʋ  
train\Voice141.wav,यो बहुसङ्ख्यक नेपालीहरूले बोल्ने भाषा हो।,j oː   b ɦ u s ŋ  kʰ  j k   n eː p aː l iː ɦ ɾ uː l eː   b oː l  n eː   bʱ aː ʂ aː   ɦ oː
train\Voice662.wav,"यहाँको दूबोमा यो गाढा चिल्लो हरितिमा छैन, खसो, खैरो, शुष्क हरियोपन मात्र छ ।",j ɦ aː ̃ k oː   d̪ uː b oː m aː   j oː   g aː ɖʱ aː   t͡ʃ i l  l oː   ɦ ɾ i t̪ i m aː   t͡ʃʰ ai n   kʰ s oː   kʰ ai ɾ oː   ʃ u ʂ  k   ɦ ɾ i j oː p n   m aː t̪  ɾ   t͡ʃʰ  
train\Voice980.wav,यदि छोरी भयो भने पेटमै मर्ने गरेको खबर आउछन्।,j d̪ i   t͡ʃʰ oː ɾ iː   bʱ j oː   bʱ n eː   p eː ʈ m ai   m ɾ  n eː   g ɾ eː k oː   kʰ b ɾ   aː u t͡ʃʰ n 
train\Voice925.wav,यो समय हामीले पहिचान गर्नुपर्दछ कि हामी आफैंको लागि बाँच्न र अरूलाई प्रभाव पार्न नसक्नु पर्छ।,j oː   s m j   ɦ aː m iː l eː   p ɦ i t͡ʃ aː n   g ɾ  n u p ɾ  d̪ t͡ʃʰ   k i   ɦ aː m iː   aː pʰ ai ̃ k oː   l aː g i   b aː ̃ t͡ʃ  n   ɾ   ə ɾ uː l aː iː   p  ɾ bʱ aː ʋ   p aː ɾ  n   n s k  n u   p ɾ  t͡ʃʰ
train\Voice611.wav,युक्रेनविरुद्ध प्रयोग गर्न रुसलाई ड्रोनहरू आपूर्ति गरेको भन्दै अस्ट्रेलियाले एक व्यवसाय र तीनजना इरानी नागरिकलाई प्रतिबन्धको घोषणा गरेको छ ।,j u k  ɾ eː n ʋ i ɾ u d̪  d̪ʱ   p  ɾ j oː g   g ɾ  n   ɾ u s l aː iː   ɖ  ɾ oː n ɦ ɾ uː   aː p uː ɾ  t̪ i   g ɾ eː k oː   bʱ n  d̪ ai   ə s  ʈ  ɾ eː l i j aː l eː   eː k   ʋ  j ʋ s aː j   ɾ   t̪ iː n d͡ʒ n aː   i ɾ aː n iː   n aː g ɾ i k l aː iː   p  ɾ t̪ i b n  d̪ʱ k oː   gʱ oː ʂ ɳ aː   g ɾ eː k oː   t͡ʃʰ  
train\Voice626.wav,उसले भनेको थियो टाउको हल्लाएर- केही खान मन छैन ।,u s l eː   bʱ n eː k oː   t̪ʰ i j oː   ʈ aː u k oː   ɦ l  l aː eː ɾ   k eː ɦ iː   kʰ aː n   m n   t͡ʃʰ ai n  
train\Voice835.wav,नारी जति पछाडी यो समस्याले हो।,n aː ɾ iː   d͡ʒ t̪ i   p t͡ʃʰ aː ɖ iː   j oː   s m s  j aː l eː   ɦ oː
train\Voice674.wav,युगको आवश्यकता र नेपाली माटाको मागबमोजिम नेपाल आमाले जन्माएका त्यस्ता साहसिक वीरहरूमध्ये सर्वाधिक महत्त्वपूर्ण ऐतिहासिक महारथी हुन्-पृथ्वीनारायण शाह।,j u g k oː   aː ʋ ʃ  j k t̪ aː   ɾ   n eː p aː l iː   m aː ʈ aː k oː   m aː g b m oː d͡ʒ i m   n eː p aː l   aː m aː l eː   d͡ʒ n  m aː eː k aː   t̪  j s  t̪ aː   s aː ɦ s i k   ʋ iː ɾ ɦ ɾ uː m d̪ʱ  j eː   s ɾ  ʋ aː d̪ʱ i k   m ɦ t̪  t̪  ʋ p uː ɾ  ɳ   ai t̪ i ɦ aː s i k   m ɦ aː ɾ t̪ʰ iː   ɦ u n  p t̪ʰ  ʋ iː n aː ɾ aː j ɳ   ʃ aː ɦ
train\Voice897.wav,सृष्टिमा सबभन्दा असहाय प्राणी त्यो कशकाय पीतवबर्ण बालक हो जो एक्कासि शहरबाट चुडिएर कनै गाउँमा रोपिन आइपुग्छ ।,s ʂ  ʈ i m aː   s b bʱ n  d̪ aː   ə s ɦ aː j   p  ɾ aː ɳ iː   t̪  j oː   k ʃ k aː j   p iː t̪ ʋ b ɾ  ɳ   b aː l k   ɦ oː   d͡ʒ oː   eː k  k aː s i   ʃ ɦ ɾ b aː ʈ   t͡ʃ u ɖ i eː ɾ   k n ai   g aː u ̃ m aː   ɾ oː p i n   aː i p u g  t͡ʃʰ  
train\Voice963.wav,चेलीबेटी बेचबेखन भनेको महिलालाई बेच्ने काम हो।,t͡ʃ eː l iː b eː ʈ iː   b eː t͡ʃ b eː kʰ n   bʱ n eː k oː   m ɦ i l aː l aː iː   b eː t͡ʃ  n eː   k aː m   ɦ oː
train\Voice640.wav,युक्रेनी अधिकारीले पछिल्लो समय आफ्नो भूभागमा आक्रमण गर्न रुसले इरानमा निर्मित ड्रोनहरूको प्रयोग गरिरहेको बताउँदै आएको छ ।,j u k  ɾ eː n iː   ə d̪ʱ i k aː ɾ iː l eː   p t͡ʃʰ i l  l oː   s m j   aː pʰ  n oː   bʱ uː bʱ aː g m aː   aː k  ɾ m ɳ   g ɾ  n   ɾ u s l eː   i ɾ aː n m aː   n i ɾ  m i t̪   ɖ  ɾ oː n ɦ ɾ uː k oː   p  ɾ j oː g   g ɾ i ɾ ɦ eː k oː   b t̪ aː u ̃ d̪ ai   aː eː k oː   t͡ʃʰ  
train\Voice701.wav,मेरो देश पुर्व देखि लिएर पश्चिमसम्म स्वतन्त्र छ।,m eː ɾ oː   d̪ eː ʃ   p u ɾ  ʋ   d̪ eː kʰ i   l i eː ɾ   p ʃ  t͡ʃ i m s m  m   s  ʋ t̪ n  t̪  ɾ   t͡ʃʰ
train\Voice976.wav,"किशोरले फेरि आग्रह गरेको थियो- हो, नयाँ युगका अनुसार हामीले पनि हिंड्ने बानी गर्नुपर्छ राधा !",k i ʃ oː ɾ l eː   pʰ eː ɾ i   aː g  ɾ ɦ   g ɾ eː k oː   t̪ʰ i j oː   ɦ oː   n j aː ̃   j u g k aː   ə n u s aː ɾ   ɦ aː m iː l eː   p n i   ɦ i ̃ ɖ  n eː   b aː n iː   g ɾ  n u p ɾ  t͡ʃʰ   ɾ aː d̪ʱ aː  
train\Voice28.wav,त्यो दिन उहाँ दिशाको आविष्कार गरे र त्यसैले हामीले आज दिशा हेर्न सफल भएका छौ।,t̪  j oː   d̪ i n   u ɦ aː ̃   d̪ i ʃ aː k oː   aː ʋ i ʂ  k aː ɾ   g ɾ eː   ɾ   t̪  j s ai l eː   ɦ aː m iː l eː   aː d͡ʒ   d̪ i ʃ aː   ɦ eː ɾ  n   s pʰ l   bʱ eː k aː   t͡ʃʰ au
train\Voice757.wav,पर्वतारोहण एउटा साहसिक कार्य हो।,p ɾ  ʋ t̪ aː ɾ oː ɦ ɳ   eː u ʈ aː   s aː ɦ s i k   k aː ɾ  j   ɦ oː
train\Voice723.wav,बिदाका दिन म गाउँले साथीहरूसँग नजिकेको जंगलमा घुमफिर गर्ने जान्थे।,b i d̪ aː k aː   d̪ i n   m   g aː u ̃ l eː   s aː t̪ʰ iː ɦ ɾ uː s ̃ g   n d͡ʒ i k eː k oː   d͡ʒ ̃ g l m aː   gʱ u m pʰ i ɾ   g ɾ  n eː   d͡ʒ aː n  t̪ʰ eː
train\Voice538.wav,तर उ यति सानी थिई कि केके कुरा गर्ने उसँग ?,t̪ ɾ   u   j t̪ i   s aː n iː   t̪ʰ i iː   k i   k eː k eː   k u ɾ aː   g ɾ  n eː   u s ̃ g  
train\Voice847.wav,"फाल्तू समयमा मात्र पत्रिका पढेर समयको सदुपयोग गर्ने मानिस नै बुद्धिमानी ठहरिन्छ, आधुनिक युगमा व्यक्ति, समाज तथा राष्ट्रको उन्नति हुनका ।",pʰ aː l  t̪ uː   s m j m aː   m aː t̪  ɾ   p t̪  ɾ i k aː   p ɖʱ eː ɾ   s m j k oː   s d̪ u p j oː g   g ɾ  n eː   m aː n i s   n ai   b u d̪  d̪ʱ i m aː n iː   ʈʰ ɦ ɾ i n  t͡ʃʰ   aː d̪ʱ u n i k   j u g m aː   ʋ  j k  t̪ i   s m aː d͡ʒ   t̪ t̪ʰ aː   ɾ aː ʂ  ʈ  ɾ k oː   u n  n t̪ i   ɦ u n k aː  
train\Voice593.wav,"यदि प्रकृति अनुशासनमा रहेन भने मानवजीवनको अस्तित्व नै संकटमा पर्दछ, प्रकृतिमा पाइने यस्तो अनुशासन मानिसका लागि प्रेरणादायी बनेको छ।",j d̪ i   p  ɾ k t̪ i   ə n u ʃ aː s n m aː   ɾ ɦ eː n   bʱ n eː   m aː n ʋ d͡ʒ iː ʋ n k oː   ə s  t̪ i t̪  ʋ   n ai   s ̃ k ʈ m aː   p ɾ  d̪ t͡ʃʰ   p  ɾ k t̪ i m aː   p aː i n eː   j s  t̪ oː   ə n u ʃ aː s n   m aː n i s k aː   l aː g i   p  ɾ eː ɾ ɳ aː d̪ aː j iː   b n eː k oː   t͡ʃʰ
train\Voice631.wav,"रूखा, साना-साना जर्घ्व-केश चौंरी गाईको चमरजस्तो कडा र खस्रो थियो जसको टुप्पो सुकेको परालको जस्तो धृमिल पीतवर्णको थियो ।",ɾ uː kʰ aː   s aː n aː s aː n aː   d͡ʒ ɾ  gʱ  ʋ k eː ʃ   t͡ʃ au ̃ ɾ iː   g aː iː k oː   t͡ʃ m ɾ d͡ʒ s  t̪ oː   k ɖ aː   ɾ   kʰ s  ɾ oː   t̪ʰ i j oː   d͡ʒ s k oː   ʈ u p  p oː   s u k eː k oː   p ɾ aː l k oː   d͡ʒ s  t̪ oː   d̪ʱ m i l   p iː t̪ ʋ ɾ  ɳ k oː   t̪ʰ i j oː  
train\Voice696.wav,मनिष आफ्नो स्वार्थको लागि समस्याहरु उत्पन्न गर्छन ।,m n i ʂ   aː pʰ  n oː   s  ʋ aː ɾ  t̪ʰ k oː   l aː g i   s m s  j aː ɦ ɾ u   u t̪  p n  n   g ɾ  t͡ʃʰ n  
