path,labels,phonemes
train\Voice578.wav,त्यसैले हामीले गाउँलाई सहरमा परिवर्तन गर्नु छन् भने सरकारी पुस्तकालय बनाउन सरकार संग माग गर्नुपर्छ।,t̪  j s ai l eː   ɦ aː m iː l eː   g aː u ̃ l aː iː   s ɦ ɾ m aː   p ɾ i ʋ ɾ  t̪ n   g ɾ  n u   t͡ʃʰ n    bʱ n eː   s ɾ k aː ɾ iː   p u s  t̪ k aː l j   b n aː u n   s ɾ k aː ɾ   s ̃ g   m aː g   g ɾ  n u p ɾ  t͡ʃʰ
train\Voice34.wav,हामी त्यहाँ गयौं ।,ɦ aː m iː   t̪  j ɦ aː ̃   g j au ̃  
train\Voice545.wav,"जस्तै-प्रिथिवी नारायण शाह,बलभद्र कुँवर आदि।",d͡ʒ s  t̪ ai p  ɾ i t̪ʰ i ʋ iː   n aː ɾ aː j ɳ   ʃ aː ɦ b l bʱ d̪  ɾ   k u ̃ ʋ ɾ   aː d̪ i
train\Voice65.wav,मलाई कक्षाका साथीहरू निकै मन पराउथे।,m l aː iː   k k  ʂ aː k aː   s aː t̪ʰ iː ɦ ɾ uː   n i k ai   m n   p ɾ aː u t̪ʰ eː
train\Voice540.wav,उस दिन खास गरी गाई-गोरुका गोबरबाट पहाड जस्तो बनाई त्यसैलाई गोवर्धन पर्वत मानेर पूजा गर्ने गरिन्छ।,u s   d̪ i n   kʰ aː s   g ɾ iː   g aː iː g oː ɾ u k aː   g oː b ɾ b aː ʈ   p ɦ aː ɖ   d͡ʒ s  t̪ oː   b n aː iː   t̪  j s ai l aː iː   g oː ʋ ɾ  d̪ʱ n   p ɾ  ʋ t̪   m aː n eː ɾ   p uː d͡ʒ aː   g ɾ  n eː   g ɾ i n  t͡ʃʰ
train\Voice148.wav,"त्यसैगरी हामीले पनि आफ्ना कर्तव्यहरू इमानदारी पूर्वक गरेर कर तिर्ने देखि लिएर बिजुली, खानेपानीको पैसा पनि समय मे दिई असल उदाहरण बन्नुपर्छ।",t̪  j s ai g ɾ iː   ɦ aː m iː l eː   p n i   aː pʰ  n aː   k ɾ  t̪ ʋ  j ɦ ɾ uː   i m aː n d̪ aː ɾ iː   p uː ɾ  ʋ k   g ɾ eː ɾ   k ɾ   t̪ i ɾ  n eː   d̪ eː kʰ i   l i eː ɾ   b i d͡ʒ u l iː   kʰ aː n eː p aː n iː k oː   p ai s aː   p n i   s m j   m eː   d̪ i iː   ə s l   u d̪ aː ɦ ɾ ɳ   b n  n u p ɾ  t͡ʃʰ
train\Voice823.wav,"यहाँ त धेरै दिनदेखि पर्खिएको मृत्यु हो यो- झन्‌ दरबारबाट मृत्युदण्डको पुष्टि भएपछि- आज हुन्छ, भोलि हुन्छ भन्दै औंलामा दिन गन्दै मृत्युलाई पर्खेर बसेको ।",j ɦ aː ̃   t̪   d̪ʱ eː ɾ ai   d̪ i n d̪ eː kʰ i   p ɾ  kʰ i eː k oː   m t̪  j u   ɦ oː   j oː   d͡ʒʱ n    d̪ ɾ b aː ɾ b aː ʈ   m t̪  j u d̪ ɳ  ɖ k oː   p u ʂ  ʈ i   bʱ eː p t͡ʃʰ i   aː d͡ʒ   ɦ u n  t͡ʃʰ   bʱ oː l i   ɦ u n  t͡ʃʰ   bʱ n  d̪ ai   au ̃ l aː m aː   d̪ i n   g n  d̪ ai   m t̪  j u l aː iː   p ɾ  kʰ eː ɾ   b s eː k oː  
train\Voice551.wav,देहातको बिराट्‌ शून्यताको स्वयं एउटा हिस्सा भएर मेरो कलिलो हृदयलाई कनै सान्त्वना दिँदैन ।,d̪ eː ɦ aː t̪ k oː   b i ɾ aː ʈ    ʃ uː n  j t̪ aː k oː   s  ʋ j ̃   eː u ʈ aː   ɦ i s  s aː   bʱ eː ɾ   m eː ɾ oː   k l i l oː   ɦ d̪ j l aː iː   k n ai   s aː n  t̪  ʋ n aː   d̪ i ̃ d̪ ai n  
train\Voice890.wav,शून्य सडकका खामामा बत्ती घोरि  र भुइँतिर हेरिरहेका छन्‌ ।,ʃ uː n  j   s ɖ k k aː   kʰ aː m aː m aː   b t̪  t̪ iː   gʱ oː ɾ i     ɾ   bʱ u i ̃ t̪ i ɾ   ɦ eː ɾ i ɾ ɦ eː k aː   t͡ʃʰ n   
train\Voice916.wav,केवल जीवित जीवनमा विश्वास गर्नेहरूले मात्र सोच्न सक्छन् र जीवनमा महान कार्यहरू गर्न सक्छन्।,k eː ʋ l   d͡ʒ iː ʋ i t̪   d͡ʒ iː ʋ n m aː   ʋ i ʃ  ʋ aː s   g ɾ  n eː ɦ ɾ uː l eː   m aː t̪  ɾ   s oː t͡ʃ  n   s k  t͡ʃʰ n    ɾ   d͡ʒ iː ʋ n m aː   m ɦ aː n   k aː ɾ  j ɦ ɾ uː   g ɾ  n   s k  t͡ʃʰ n 
train\Voice811.wav,यसै दिन दीपावलीको झिलिमिली सबैतिर परिने हुँदा नै तिहार चाडलाई ‘दीपावली’ समेत भन्ने गरिएको हो।,j s ai   d̪ i n   d̪ iː p aː ʋ l iː k oː   d͡ʒʱ i l i m i l iː   s b ai t̪ i ɾ   p ɾ i n eː   ɦ u ̃ d̪ aː   n ai   t̪ i ɦ aː ɾ   t͡ʃ aː ɖ l aː iː   d̪ iː p aː ʋ l iː   s m eː t̪   bʱ n  n eː   g ɾ i eː k oː   ɦ oː
train\Voice798.wav,"कविता, कथा, उपन्यास, नाटक, निबन्ध आदि साहित्यिक हरेक विधामा नेपाली बहस मौलाएको छ।",k ʋ i t̪ aː   k t̪ʰ aː   u p n  j aː s   n aː ʈ k   n i b n  d̪ʱ   aː d̪ i   s aː ɦ i t̪  j i k   ɦ ɾ eː k   ʋ i d̪ʱ aː m aː   n eː p aː l iː   b ɦ s   m au l aː eː k oː   t͡ʃʰ
train\Voice149.wav,बिहानले दिनको संकेत गर्छ भनेझैँ विद्यार्थी जीवनले मानिसको भविष्य राम्रो वा नराम्रो के हुने भन्ने कुराको संकेत गर्दछ।,b i ɦ aː n l eː   d̪ i n k oː   s ̃ k eː t̪   g ɾ  t͡ʃʰ   bʱ n eː d͡ʒʱ ai ̃   ʋ i d̪  j aː ɾ  t̪ʰ iː   d͡ʒ iː ʋ n l eː   m aː n i s k oː   bʱ ʋ i ʂ  j   ɾ aː m  ɾ oː   ʋ aː   n ɾ aː m  ɾ oː   k eː   ɦ u n eː   bʱ n  n eː   k u ɾ aː k oː   s ̃ k eː t̪   g ɾ  d̪ t͡ʃʰ
train\Voice814.wav,स्थानको कत्रो फैलाव नीलो आकाशको कत्रो विस्तीर्णता ।,s  t̪ʰ aː n k oː   k t̪  ɾ oː   pʰ ai l aː ʋ   n iː l oː   aː k aː ʃ k oː   k t̪  ɾ oː   ʋ i s  t̪ iː ɾ  ɳ t̪ aː  
train\Voice731.wav,सम भन्नु पर्दा पर्वतारोहण पनि मानिसले खेल्ने एक रमाइलो खेल नै हो।,s m   bʱ n  n u   p ɾ  d̪ aː   p ɾ  ʋ t̪ aː ɾ oː ɦ ɳ   p n i   m aː n i s l eː   kʰ eː l  n eː   eː k   ɾ m aː i l oː   kʰ eː l   n ai   ɦ oː
train\Voice111.wav,"भेदभाव भनेको जात,धर्म,छोराछोरी आदि बिच गरिने भेद वा तल्लो उच्चको भावलाई भेदभाव भनिन्छ।",bʱ eː d̪ bʱ aː ʋ   bʱ n eː k oː   d͡ʒ aː t̪ d̪ʱ ɾ  m t͡ʃʰ oː ɾ aː t͡ʃʰ oː ɾ iː   aː d̪ i   b i t͡ʃ   g ɾ i n eː   bʱ eː d̪   ʋ aː   t̪ l  l oː   u t͡ʃ  t͡ʃ k oː   bʱ aː ʋ l aː iː   bʱ eː d̪ bʱ aː ʋ   bʱ n i n  t͡ʃʰ
train\Voice71.wav,"घरपरिवारदेखि लिएर समाज, धर्म, संस्कृति, राजनीति, वित्त आदि सबै क्षेत्रमा अनुशासन चाहिन्छ ।",gʱ ɾ p ɾ i ʋ aː ɾ d̪ eː kʰ i   l i eː ɾ   s m aː d͡ʒ   d̪ʱ ɾ  m   s ̃ s  k t̪ i   ɾ aː d͡ʒ n iː t̪ i   ʋ i t̪  t̪   aː d̪ i   s b ai   k  ʂ eː t̪  ɾ m aː   ə n u ʃ aː s n   t͡ʃ aː ɦ i n  t͡ʃʰ  
train\Voice820.wav,बेला-बेलामा भूक्षय भइरहने गर्छ।,b eː l aː b eː l aː m aː   bʱ uː k  ʂ j   bʱ i ɾ ɦ n eː   g ɾ  t͡ʃʰ
train\Voice679.wav,मेरो बुबा आमाको मायाको छहारीमा मेरो बाल्यकाल खुबी रमाइलो भएर बित्यो।,m eː ɾ oː   b u b aː   aː m aː k oː   m aː j aː k oː   t͡ʃʰ ɦ aː ɾ iː m aː   m eː ɾ oː   b aː l  j k aː l   kʰ u b iː   ɾ m aː i l oː   bʱ eː ɾ   b i t̪  j oː
train\Voice2014.wav,कस्तो होला त्यो भेट भन्ने प्रश्न सबैको मनमस्तिश्कमा थियो।,k s  t̪ oː   ɦ oː l aː   t̪  j oː   bʱ eː ʈ   bʱ n  n eː   p  ɾ ʃ  n   s b ai k oː   m n m s  t̪ i ʃ  k m aː   t̪ʰ i j oː
train\Voice782.wav,"त्यसैले यहाँका मानिसले तिर्थाटनका लागि विदेशतिर गइरहनुपर्दैन, विभिन्न देवीदेवताका मन्दिर र तीर्थस्थल रहेको मेरो देश एक पुण्यभूमि हो।",t̪  j s ai l eː   j ɦ aː ̃ k aː   m aː n i s l eː   t̪ i ɾ  t̪ʰ aː ʈ n k aː   l aː g i   ʋ i d̪ eː ʃ t̪ i ɾ   g i ɾ ɦ n u p ɾ  d̪ ai n   ʋ i bʱ i n  n   d̪ eː ʋ iː d̪ eː ʋ t̪ aː k aː   m n  d̪ i ɾ   ɾ   t̪ iː ɾ  t̪ʰ s  t̪ʰ l   ɾ ɦ eː k oː   m eː ɾ oː   d̪ eː ʃ   eː k   p u ɳ  j bʱ uː m i   ɦ oː
train\Voice2013.wav,कलेज सकिएपछी उनिहरु पहिलोपल्ट भेट्न लागिरहेका थिए।,k l eː d͡ʒ   s k i eː p t͡ʃʰ iː   u n i ɦ ɾ u   p ɦ i l oː p l  ʈ   bʱ eː ʈ  n   l aː g i ɾ ɦ eː k aː   t̪ʰ i eː
train\Voice799.wav,नेपालमा ठूला-ठूला जंगलहरु छन्।,n eː p aː l m aː   ʈʰ uː l aː ʈʰ uː l aː   d͡ʒ ̃ g l ɦ ɾ u   t͡ʃʰ n 
train\Voice572.wav,यी हामी सबै नेपालीको प्यारो देश हो र यसलाई हामीले आफ्नो प्राणभन्दा प्यारो ठानेका छौँ।,j iː   ɦ aː m iː   s b ai   n eː p aː l iː k oː   p  j aː ɾ oː   d̪ eː ʃ   ɦ oː   ɾ   j s l aː iː   ɦ aː m iː l eː   aː pʰ  n oː   p  ɾ aː ɳ bʱ n  d̪ aː   p  j aː ɾ oː   ʈʰ aː n eː k aː   t͡ʃʰ au ̃
train\Voice102.wav,पर्वतारोहण मानिसको सोखको कुरा हो।,p ɾ  ʋ t̪ aː ɾ oː ɦ ɳ   m aː n i s k oː   s oː kʰ k oː   k u ɾ aː   ɦ oː
train\Voice1001.wav,महंगा लुगा र घरको चीजहरू किन्नुहोस् - के लागि? यो सबै एक राम्रो सामाजिक खडा स्थापित गर्न को लागी।,m ɦ ̃ g aː   l u g aː   ɾ   gʱ ɾ k oː   t͡ʃ iː d͡ʒ ɦ ɾ uː   k i n  n u ɦ oː s      k eː   l aː g i   j oː   s b ai   eː k   ɾ aː m  ɾ oː   s aː m aː d͡ʒ i k   kʰ ɖ aː   s  t̪ʰ aː p i t̪   g ɾ  n   k oː   l aː g iː
train\Voice582.wav,हत्केलाले मुख र नाकलाई पुछ्दै स्वाँ... स्वाँ गर्दै उसले भनी- म पर्छ्वारेया (पश्चिमपट्टिको) धारमा नुहाइरहेकी थिएँ ।,ɦ t̪  k eː l aː l eː   m u kʰ   ɾ   n aː k l aː iː   p u t͡ʃʰ  d̪ ai   s  ʋ aː ̃   s  ʋ aː ̃   g ɾ  d̪ ai   u s l eː   bʱ n iː   m   p ɾ  t͡ʃʰ  ʋ aː ɾ eː j aː   p ʃ  t͡ʃ i m p ʈ  ʈ i k oː   d̪ʱ aː ɾ m aː   n u ɦ aː i ɾ ɦ eː k iː   t̪ʰ i eː ̃  
train\Voice813.wav,"अनुशासनको पालना आफूभित्रैबाट हुनुपर्दछ, सबैले सचेत भई सामाजिक नीति-नियमका घेराभित्र रहेर काम गर्नु उचित हुन्छ।",ə n u ʃ aː s n k oː   p aː l n aː   aː pʰ uː bʱ i t̪  ɾ ai b aː ʈ   ɦ u n u p ɾ  d̪ t͡ʃʰ   s b ai l eː   s t͡ʃ eː t̪   bʱ iː   s aː m aː d͡ʒ i k   n iː t̪ i n i j m k aː   gʱ eː ɾ aː bʱ i t̪  ɾ   ɾ ɦ eː ɾ   k aː m   g ɾ  n u   u t͡ʃ i t̪   ɦ u n  t͡ʃʰ
train\Voice914.wav,नत्र ति साच्चैका अवसर बिहिन नारीहरुको नाम भजाएर सिमित नाकहरु ठड्याउनका लागि देखाइने यो गाइजात्रे ।,n t̪  ɾ   t̪ i   s aː t͡ʃ  t͡ʃ ai k aː   ə ʋ s ɾ   b i ɦ i n   n aː ɾ iː ɦ ɾ u k oː   n aː m   bʱ d͡ʒ aː eː ɾ   s i m i t̪   n aː k ɦ ɾ u   ʈʰ ɖ  j aː u n k aː   l aː g i   d̪ eː kʰ aː i n eː   j oː   g aː i d͡ʒ aː t̪  ɾ eː  
train\Voice892.wav,"आफ्ना काखमारहेका असंख्य नदीनाला,हिमश्रीन्खालम, वनजंगल जस्ता प्राकृतिक सम्पत्ति र र पुराना जमानाक सुन्दर ।",aː pʰ  n aː   k aː kʰ m aː ɾ ɦ eː k aː   ə s ̃ kʰ  j   n d̪ iː n aː l aː ɦ i m ʃ  ɾ iː n  kʰ aː l m   ʋ n d͡ʒ ̃ g l   d͡ʒ s  t̪ aː   p  ɾ aː k t̪ i k   s m  p t̪  t̪ i   ɾ   ɾ   p u ɾ aː n aː   d͡ʒ m aː n aː k   s u n  d̪ ɾ  
train\Voice969.wav,"उसको हात आफ्नो हातमा लिएर- हामी दुवैले मिलेर आफ्नो छोरालाई राम्ररी हेरौंला, माया गरौंला, पढाउँला-लेखाउँला र ठूलो पारौंला ।",u s k oː   ɦ aː t̪   aː pʰ  n oː   ɦ aː t̪ m aː   l i eː ɾ   ɦ aː m iː   d̪ u ʋ ai l eː   m i l eː ɾ   aː pʰ  n oː   t͡ʃʰ oː ɾ aː l aː iː   ɾ aː m  ɾ ɾ iː   ɦ eː ɾ au ̃ l aː   m aː j aː   g ɾ au ̃ l aː   p ɖʱ aː u ̃ l aː l eː kʰ aː u ̃ l aː   ɾ   ʈʰ uː l oː   p aː ɾ au ̃ l aː  
train\Voice575.wav,ती मध्ये एक खतरनाक र अहिले बढी मात्रामा चलिरहेको समस्या लागु पदार्थ हुन्।,t̪ iː   m d̪ʱ  j eː   eː k   kʰ t̪ ɾ n aː k   ɾ   ə ɦ i l eː   b ɖʱ iː   m aː t̪  ɾ aː m aː   t͡ʃ l i ɾ ɦ eː k oː   s m s  j aː   l aː g u   p d̪ aː ɾ  t̪ʰ   ɦ u n 
train\Voice937.wav,"यो देहातमा बारम्बार सम्झना हुन्छ, कम्पनी बगैंचाको ।",j oː   d̪ eː ɦ aː t̪ m aː   b aː ɾ m  b aː ɾ   s m  d͡ʒʱ n aː   ɦ u n  t͡ʃʰ   k m  p n iː   b g ai ̃ t͡ʃ aː k oː  
train\Voice841.wav,यस चाडमा खास गरी पटका पड्काएर अनि आतसबाजी गरेर मनोरञ्जन लिने चलन निकै बढ्दो छ।,j s   t͡ʃ aː ɖ m aː   kʰ aː s   g ɾ iː   p ʈ k aː   p ɖ  k aː eː ɾ   ə n i   aː t̪ s b aː d͡ʒ iː   g ɾ eː ɾ   m n oː ɾ ɲ  d͡ʒ n   l i n eː   t͡ʃ l n   n i k ai   b ɖʱ  d̪ oː   t͡ʃʰ
train\Voice162.wav,अचेल नेपालीहरुले विदेशीहरुलाई पाहुना ठान्ने र आवश्यक सेवाशुल्क लिई उनीहरुको आदर-सत्कार गर्ने नयाँ चलन अँगालेका छन् तापनि ।,ə t͡ʃ eː l   n eː p aː l iː ɦ ɾ u l eː   ʋ i d̪ eː ʃ iː ɦ ɾ u l aː iː   p aː ɦ u n aː   ʈʰ aː n  n eː   ɾ   aː ʋ ʃ  j k   s eː ʋ aː ʃ u l  k   l i iː   u n iː ɦ ɾ u k oː   aː d̪ ɾ s t̪  k aː ɾ   g ɾ  n eː   n j aː ̃   t͡ʃ l n   ə ̃ g aː l eː k aː   t͡ʃʰ n    t̪ aː p n i  
train\Voice977.wav,"हामीहरूले छोहोरा, मिश्री र नरिवल किन्यौं ।",ɦ aː m iː ɦ ɾ uː l eː   t͡ʃʰ oː ɦ oː ɾ aː   m i ʃ  ɾ iː   ɾ   n ɾ i ʋ l   k i n  j au ̃  
train\Voice119.wav,हुन् त् नेपालमा अरू थुप्रै भाषाहरू बोलिन्छन् तर सम्पूर्ण नेपालीहरूका बीचमा सम्पर्क कायम गर्ने भाषामा रूपमा नेपाली भाषा नै रहेको छ।,ɦ u n    t̪    n eː p aː l m aː   ə ɾ uː   t̪ʰ u p  ɾ ai   bʱ aː ʂ aː ɦ ɾ uː   b oː l i n  t͡ʃʰ n    t̪ ɾ   s m  p uː ɾ  ɳ   n eː p aː l iː ɦ ɾ uː k aː   b iː t͡ʃ m aː   s m  p ɾ  k   k aː j m   g ɾ  n eː   bʱ aː ʂ aː m aː   ɾ uː p m aː   n eː p aː l iː   bʱ aː ʂ aː   n ai   ɾ ɦ eː k oː   t͡ʃʰ
train\Voice755.wav,"न हो यो त्त्यस्तो अकस्मात्‌को मृत्यु जस्तो कि युद्धमा तातो गोली खाएर प्राण उडेको हुन्छ- सोच्दै नसोचेको गोली लाग्छ छातीमा, अनि त्यही अकस्मात्‌को आश्चर्यमा मान्छेको शरीर सेलाइहाल्छ ।",n   ɦ oː   j oː   t̪  t̪  j s  t̪ oː   ə k s  m aː t̪  k oː   m t̪  j u   d͡ʒ s  t̪ oː   k i   j u d̪  d̪ʱ m aː   t̪ aː t̪ oː   g oː l iː   kʰ aː eː ɾ   p  ɾ aː ɳ   u ɖ eː k oː   ɦ u n  t͡ʃʰ   s oː t͡ʃ  d̪ ai   n s oː t͡ʃ eː k oː   g oː l iː   l aː g  t͡ʃʰ   t͡ʃʰ aː t̪ iː m aː   ə n i   t̪  j ɦ iː   ə k s  m aː t̪  k oː   aː ʃ  t͡ʃ ɾ  j m aː   m aː n  t͡ʃʰ eː k oː   ʃ ɾ iː ɾ   s eː l aː i ɦ aː l  t͡ʃʰ  
train\Voice834.wav,"भ्याउ, काई, लेउ र पानीका लहराहरूले घेरिएर उभिएको थियो, पोखरीको मध्यमा एउटा कालो अग्राखको काठ।",bʱ  j aː u   k aː iː   l eː u   ɾ   p aː n iː k aː   l ɦ ɾ aː ɦ ɾ uː l eː   gʱ eː ɾ i eː ɾ   u bʱ i eː k oː   t̪ʰ i j oː   p oː kʰ ɾ iː k oː   m d̪ʱ  j m aː   eː u ʈ aː   k aː l oː   ə g  ɾ aː kʰ k oː   k aː ʈʰ
train\Voice718.wav,"हाम्रो समाजमा ‘गाँस छोड्नु,साथ नछोड्नू’ उखान ज्यादै लोकप्रिय छ।",ɦ aː m  ɾ oː   s m aː d͡ʒ m aː   g aː ̃ s   t͡ʃʰ oː ɖ  n u s aː t̪ʰ   n t͡ʃʰ oː ɖ  n uː   u kʰ aː n   d͡ʒ  j aː d̪ ai   l oː k p  ɾ i j   t͡ʃʰ
train\Voice552.wav,विश्वमा नेपाललाई चिन्नेले हामी नेपालीलाई पनि चिन्दछ।,ʋ i ʃ  ʋ m aː   n eː p aː l l aː iː   t͡ʃ i n  n eː l eː   ɦ aː m iː   n eː p aː l iː l aː iː   p n i   t͡ʃ i n  d̪ t͡ʃʰ
train\Voice95.wav,देशभक्तिलाई सर्वोपरि आधार र राष्ट्र निर्माणलाई अन्तिम लक्ष्य बनाएर युद्धारम्भ गरेका पृथ्वी जब एउटा घरका भाइ आपसमा झगडा गरे।,d̪ eː ʃ bʱ k  t̪ i l aː iː   s ɾ  ʋ oː p ɾ i   aː d̪ʱ aː ɾ   ɾ   ɾ aː ʂ  ʈ  ɾ   n i ɾ  m aː ɳ l aː iː   ə n  t̪ i m   l k  ʂ  j   b n aː eː ɾ   j u d̪  d̪ʱ aː ɾ m  bʱ   g ɾ eː k aː   p t̪ʰ  ʋ iː   d͡ʒ b   eː u ʈ aː   gʱ ɾ k aː   bʱ aː i   aː p s m aː   d͡ʒʱ g ɖ aː   g ɾ eː
train\Voice114.wav,तुलसीको मठलाई सफासँग लिपेर स्वच्छ बनाएको थियो ।,t̪ u l s iː k oː   m ʈʰ l aː iː   s pʰ aː s ̃ g   l i p eː ɾ   s  ʋ t͡ʃ  t͡ʃʰ   b n aː eː k oː   t̪ʰ i j oː  
train\Voice676.wav,शहरबाट सञ्चित गरेर ल्याएको कातर हृदयको भय उसको सङ्गतमा बिस्तार-बिस्तार लोप हुन लागेको जस्तो भयो ।,ʃ ɦ ɾ b aː ʈ   s ɲ  t͡ʃ i t̪   g ɾ eː ɾ   l  j aː eː k oː   k aː t̪ ɾ   ɦ d̪ j k oː   bʱ j   u s k oː   s ŋ  g t̪ m aː   b i s  t̪ aː ɾ b i s  t̪ aː ɾ   l oː p   ɦ u n   l aː g eː k oː   d͡ʒ s  t̪ oː   bʱ j oː  
train\Voice680.wav,नेपाली भाषा साहित्यिक दृष्टिले पनि निकै धनी छ।,n eː p aː l iː   bʱ aː ʂ aː   s aː ɦ i t̪  j i k   d̪ ʂ  ʈ i l eː   p n i   n i k ai   d̪ʱ n iː   t͡ʃʰ
train\Voice989.wav,"सान्नानीलाई मैले आदर-स्नेह गर्ने कुनै बाटो पाइनँ, केवल बनारसदेखि बचाएर राखेको एक आना पैसा मेरो खल्तीमा थियो ।",s aː n  n aː n iː l aː iː   m ai l eː   aː d̪ ɾ s  n eː ɦ   g ɾ  n eː   k u n ai   b aː ʈ oː   p aː i n ̃   k eː ʋ l   b n aː ɾ s d̪ eː kʰ i   b t͡ʃ aː eː ɾ   ɾ aː kʰ eː k oː   eː k   aː n aː   p ai s aː   m eː ɾ oː   kʰ l  t̪ iː m aː   t̪ʰ i j oː  
train\Voice1005.wav,हाम्रो गाउँको पूर्वपट्टिको सिमाना पनि यही नदी हो ।,ɦ aː m  ɾ oː   g aː u ̃ k oː   p uː ɾ  ʋ p ʈ  ʈ i k oː   s i m aː n aː   p n i   j ɦ iː   n d̪ iː   ɦ oː  
train\Voice974.wav,दरबारमा राजा-रानी र अरू राजपरिवारका प्राणीहरू सुतेका थिए ।,d̪ ɾ b aː ɾ m aː   ɾ aː d͡ʒ aː ɾ aː n iː   ɾ   ə ɾ uː   ɾ aː d͡ʒ p ɾ i ʋ aː ɾ k aː   p  ɾ aː ɳ iː ɦ ɾ uː   s u t̪ eː k aː   t̪ʰ i eː  
train\Voice788.wav,मा पूर्वपट्टि मुहडा गरेर बालुवाको राशिउपर कोल्टे पल्टेकी थिई ।,m aː   p uː ɾ  ʋ p ʈ  ʈ i   m u ɦ ɖ aː   g ɾ eː ɾ   b aː l u ʋ aː k oː   ɾ aː ʃ i u p ɾ   k oː l  ʈ eː   p l  ʈ eː k iː   t̪ʰ i iː  
train\Voice585.wav,त्यस कारणले हामीले सक्ने काम गरेर देशको अवस्थालाई अझ गतिलो बनाउनुपर्छ।,t̪  j s   k aː ɾ ɳ l eː   ɦ aː m iː l eː   s k  n eː   k aː m   g ɾ eː ɾ   d̪ eː ʃ k oː   ə ʋ s  t̪ʰ aː l aː iː   ə d͡ʒʱ   g t̪ i l oː   b n aː u n u p ɾ  t͡ʃʰ
train\Voice556.wav,"जसमा अनेकानेक रङ्गका फूलका बिरुवाहरू सजाइएका छन्‌, सानो हावामा पनि चञ्चल भएर शिर हल्लाउन थाल्छन्‌ मानौं उत्साहको लहर तिनीहरूमा फैलिन पुगेको छ ।",d͡ʒ s m aː   ə n eː k aː n eː k   ɾ ŋ  g k aː   pʰ uː l k aː   b i ɾ u ʋ aː ɦ ɾ uː   s d͡ʒ aː i eː k aː   t͡ʃʰ n    s aː n oː   ɦ aː ʋ aː m aː   p n i   t͡ʃ ɲ  t͡ʃ l   bʱ eː ɾ   ʃ i ɾ   ɦ l  l aː u n   t̪ʰ aː l  t͡ʃʰ n    m aː n au ̃   u t̪  s aː ɦ k oː   l ɦ ɾ   t̪ i n iː ɦ ɾ uː m aː   pʰ ai l i n   p u g eː k oː   t͡ʃʰ  
train\Voice935.wav,मेरो एक्लो हृदयको सारा विकलतामा ती स्नेहका धूमिल रेखा अड्ण मायामय भएर गए; म भरिएँ र पुनः आमाको पिठयूँलाई अंकमाल गर्न पुगें ।,m eː ɾ oː   eː k  l oː   ɦ d̪ j k oː   s aː ɾ aː   ʋ i k l t̪ aː m aː   t̪ iː   s  n eː ɦ k aː   d̪ʱ uː m i l   ɾ eː kʰ aː   ə ɖ  ɳ   m aː j aː m j   bʱ eː ɾ   g eː   m   bʱ ɾ i eː ̃   ɾ   p u n ʰ   aː m aː k oː   p i ʈʰ j uː ̃ l aː iː   ə ̃ k m aː l   g ɾ  n   p u g eː ̃  
train\Voice527.wav,नेपाली सर्वप्रथम पुस्तकालयको निर्माणमा अगाडि बढाउने मान्छे जोन उड हुन्।,n eː p aː l iː   s ɾ  ʋ p  ɾ t̪ʰ m   p u s  t̪ k aː l j k oː   n i ɾ  m aː ɳ m aː   ə g aː ɖ i   b ɖʱ aː u n eː   m aː n  t͡ʃʰ eː   d͡ʒ oː n   u ɖ   ɦ u n 
train\Voice990.wav,नेपाल अधिराज्य भरका हिन्दूहरूले यो चाड धूमधामसँग मनाउँछन्।,n eː p aː l   ə d̪ʱ i ɾ aː d͡ʒ  j   bʱ ɾ k aː   ɦ i n  d̪ uː ɦ ɾ uː l eː   j oː   t͡ʃ aː ɖ   d̪ʱ uː m d̪ʱ aː m s ̃ g   m n aː u ̃ t͡ʃʰ n 
train\Voice683.wav,"‘दस कुवा बराबर एउटा पोखरी हुन्छ, दस पोखरी बराबर एउटा पुत्र हुन्छ, दस पुत्रहरू बराबर एउटा रुख हुन्छ।",d̪ s   k u ʋ aː   b ɾ aː b ɾ   eː u ʈ aː   p oː kʰ ɾ iː   ɦ u n  t͡ʃʰ   d̪ s   p oː kʰ ɾ iː   b ɾ aː b ɾ   eː u ʈ aː   p u t̪  ɾ   ɦ u n  t͡ʃʰ   d̪ s   p u t̪  ɾ ɦ ɾ uː   b ɾ aː b ɾ   eː u ʈ aː   ɾ u kʰ   ɦ u n  t͡ʃʰ
